{
  "schema_version": "1.0",
  "score_id": "d5277cef-1c79-4650-8aef-d61d55ca5b49",
  "pid": "7K3M9QX",
  "study_id": "s2_pilot",
  "wave": 1,
  "occasion_id": "t1",
  "instrument_id": "bscs",
  "instrument_version": "1.0.0",
  "scale_id": "total",
  "score": 3.38,
  "score_type": "mean",
  "n_answered": 13,
  "n_items": 13,
  "key_version": "1.0.0",
  "algorithm_version": "0.1.0",
  "prorated": false,
  "planned_missing": false,
  "na_reason": null,
  "flags": [],
  "source_response_ids": ["54917daf-61c4-4193-934b-c7c2514bd3b8"],
  "scoring_run_id": "0a0bce65-d217-49b7-81a6-a8d409432c8d",
  "data_snapshot_id": null,
  "computed_at": "2026-10-21T12:00:00Z"
}
