{
  "schema_version": "1.0",
  "score_id": "7f59cfab-3188-44ce-a0a8-39858d5b01e5",
  "pid": "7K3M9QX",
  "study_id": "s2_pilot",
  "wave": 1,
  "occasion_id": "t1",
  "instrument_id": "cfi",
  "instrument_version": "1.0.0",
  "scale_id": "alternatives",
  "score": null,
  "score_type": "mean",
  "n_answered": 0,
  "n_items": 14,
  "key_version": "1.0.0",
  "algorithm_version": "0.1.0",
  "prorated": false,
  "planned_missing": true,
  "na_reason": "planned_missing",
  "flags": [],
  "source_response_ids": [],
  "scoring_run_id": "0a0bce65-d217-49b7-81a6-a8d409432c8d",
  "data_snapshot_id": null,
  "computed_at": "2026-10-21T12:00:00Z"
}
